{
  "name": "Showcase",
  "schema": "feather-tokens/2",
  "colors": {
    "background": "#FAF7F2",
    "surface": "#FFFFFF",
    "text": "#1B1A17",
    "primary": "#C2410C"
  },
  "typography": {
    "fontFamily": {
      "display": "JetBrains Mono",
      "body": "JetBrains Mono"
    }
  },
  "shape": "sharp",
  "density": "comfortable",
  "elevation": "flat",
  "motion": "calm"
}
